{
  "topic": "후버댐 콘크리트 냉각",
  "hook_candidates": [
    {
      "claim": "후버댐은 한 덩어리가 아니라 230개 블록을 따로 부어 쌓은 조립체다",
      "why_surprising": "댐은 통짜 콘크리트 덩어리라는 통념과 정면으로 어긋난다",
      "grounded_in": ["f03", "f04"]
    },
    {
      "claim": "후버댐 안에는 냉장고 배관이 933킬로미터 묻혀 있다",
      "why_surprising": "구조물 안에 냉각 장치가 들어간다는 발상 자체가 낯설다",
      "grounded_in": ["f07", "f08"]
    },
    {
      "claim": "그냥 두었다면 후버댐 콘크리트는 125년 동안 식고 있었을 것이다",
      "why_surprising": "굳는 것과 식는 것이 다른 일이라는 점이 드러난다",
      "grounded_in": ["f05"]
    }
  ],
  "chosen_hook": 0,
  "why_chosen": "반전 부정문이라 첫 줄에서 통념을 바로 친다. 마지막 단이 같은 조립체 이야기로 돌아와 수미상관이 되고, 냉각 배관과 125년은 그 조립체를 설명하는 과정에서 자연히 실린다",
  "acts": [
    {
      "act": 1,
      "name": "통짜가 아니다",
      "char_budget": 88,
      "must_convey": ["230개 블록의 조립체", "통짜라는 통념이 틀렸다는 것", "댐의 규모"],
      "grounded_in": ["f01", "f03", "f04"]
    },
    {
      "act": 2,
      "name": "굳으면서 스스로 뜨거워진다",
      "char_budget": 132,
      "must_convey": ["콘크리트가 굳으며 내는 열", "그냥 식기를 기다리면 125년", "공사 일정과 맞지 않는다는 것"],
      "grounded_in": ["f02", "f05", "f06"]
    },
    {
      "act": 3,
      "name": "식는 속도가 다르면 갈라진다",
      "char_budget": 110,
      "must_convey": ["겉과 속의 수축 차", "균열", "겉만 식히는 방법이 역효과라는 것"],
      "grounded_in": ["f06", "f09", "f10"]
    },
    {
      "act": 4,
      "name": "통으로 짓기를 포기한다",
      "char_budget": 132,
      "must_convey": ["230개 기둥 블록으로 분할", "블록마다 따로 붓고 따로 식힌다", "냉각 강관 933킬로미터", "125년이 2년으로"],
      "grounded_in": ["f03", "f07", "f08", "f11"]
    },
    {
      "act": 5,
      "name": "지금 서 있는 것은 조립체다",
      "char_budget": 88,
      "must_convey": ["블록 사이를 시멘트로 메워 하나로 잇는다", "지금의 후버댐이 그 조립체", "오늘날 댐 공사에 그대로 쓰인다"],
      "grounded_in": ["f03", "f12"]
    }
  ]
}
