{
  "topic": "후버댐 콘크리트 냉각",
  "hook_candidates": [
    {
      "claim": "후버댐은 하나의 거대한 콘크리트 덩어리가 아니라, 따로 붓고 따로 식힌 기둥 수백 개를 나중에 붙여 놓은 조립체다.",
      "why_surprising": "누구나 후버댐을 '한 번에 부어 만든 통짜 콘크리트 벽'으로 상상한다. 실제로는 개별 블록을 따로 타설하고, 냉각 수축으로 벌어진 틈에 그라우트를 밀어넣어 사후에 한 덩어리로 만든 것이다.",
      "grounded_in": [
        "f01",
        "f02",
        "f22"
      ]
    },
    {
      "claim": "후버댐 콘크리트 안에는 냉각용 강관 937km가 아직도 뽑히지 않은 채 박혀 있다.",
      "why_surprising": "공사용 임시 설비는 끝나면 철거한다는 통념과 어긋난다. 이 관들은 잘려나간 뒤 그라우트로 채워져 구조체의 일부가 됐다.",
      "grounded_in": [
        "f10",
        "f24"
      ]
    },
    {
      "claim": "후버댐 냉각 공법의 실물 검증은 후버댐이 아니라 오리건의 이름 없는 댐에서 먼저 끝나 있었다.",
      "why_surprising": "후버댐이 이 기술의 출발점이라는 통념과 어긋난다. 타설 2년 전 오와이히댐 시험 구간에서 검증됐고 후버댐 시스템은 그것의 소폭 변경판이었다.",
      "grounded_in": [
        "f28",
        "f30"
      ]
    },
    {
      "claim": "널리 인용되는 '125년'은 실제로 벌어진 일이 아니라, 하지 않기로 한 선택에 붙은 조건부 계산값이다.",
      "why_surprising": "'식는 데 125년 걸릴 뻔했다'가 사실 기록처럼 유통되지만, 원문은 '한 번의 연속 타설로 지었다면'이라는 가정절이다.",
      "grounded_in": [
        "f05",
        "f52"
      ]
    }
  ],
  "chosen_hook": 0,
  "why_chosen": "125년 축은 최근 한국어 쇼츠와 나무위키가 이미 선점해 소진됐고, '통짜가 아니다'는 완성된 외관을 보는 시청자의 눈과 정면으로 충돌하면서 이후 모든 단(왜 나눠 부었나 → 어떻게 식혔나 → 어떻게 다시 붙였나)을 하나의 인과선으로 꿰어준다. 125년은 훅이 아니라 중반 딜레마의 근거로 내려 쓴다.",
  "acts": [
    {
      "act": 1,
      "name": "통짜가 아니다",
      "char_budget": 75,
      "must_convey": [
        "후버댐은 하나의 콘크리트 덩어리가 아니라 개별 기둥(블록)을 따로 타설해 쌓아 올린 구조물이다",
        "기둥 수는 약 215개로 '추정된다' — medium이므로 단정하지 말 것",
        "완성된 외관에는 이 경계가 보이지 않는다는 점"
      ],
      "grounded_in": [
        "f01",
        "f02"
      ]
    },
    {
      "act": 2,
      "name": "뜨거워서가 아니라 식어서 갈라진다",
      "char_budget": 95,
      "must_convey": [
        "문제는 콘크리트가 뜨거운 것 자체가 아니라 식으면서 수축한다는 것",
        "안쪽과 바깥쪽이 서로 다른 속도로 식으면 잡아당기는 힘이 생겨 균열이 난다 — 이 2단 논리를 뭉개지 말 것",
        "한 번에 통으로 부으면 그 응력이 댐을 갈라지고 부서지게 만든다는 계산 때문에 설계 단계에서 폐기됐다",
        "시멘트 조성·분말도·양생 온도·골재 치수가 수화열에 미치는 영향까지 따진 전례 없는 조사, 그 결과 저열 시멘트 채택"
      ],
      "grounded_in": [
        "f06",
        "f36",
        "f26"
      ]
    },
    {
      "act": 3,
      "name": "125년은 하지 않은 선택의 값이다",
      "char_budget": 95,
      "must_convey": [
        "125년은 '한 번의 연속 타설로 지었다면 주위 온도까지 식는 데 걸릴 시간'이라는 조건부 계산값",
        "실제 경과 시간도 아니고 냉각 시스템이 단축한 공기도 아니다 — 2차 매체에서 두 뜻이 뒤섞여 유통된다",
        "물리적으로는 더 빨리 부을 수 있었지만 열 때문에 속도를 규제로 묶었다: 블록당 5피트 리프트, 72시간에 1리프트, 30일에 7리프트 상한"
      ],
      "grounded_in": [
        "f05",
        "f52",
        "f16"
      ]
    },
    {
      "act": 4,
      "name": "첫 실험장은 후버댐이 아니었다",
      "char_budget": 80,
      "must_convey": [
        "파이프 냉각을 후버댐에 곧바로 적용한 것이 아니다",
        "타설 시작 2년 전인 1931년 여름, 오리건주 오와이히댐에서 실물 시험을 먼저 거쳤다",
        "후버댐에 쓰인 냉각 시스템은 오와이히에서 쓴 것을 소폭 변경한 수준이었다",
        "시험 구간 규모(28피트×210피트, 4피트 리프트)는 medium이므로 쓰더라도 단정 어조를 피할 것"
      ],
      "grounded_in": [
        "f28",
        "f30",
        "f29"
      ]
    },
    {
      "act": 5,
      "name": "콘크리트 안에 얼음공장을 묻다",
      "char_budget": 100,
      "must_convey": [
        "블록 안에 1인치 강관을 그물처럼 매설했고 총연장은 582마일 이상(약 937km) — 이 값 하나로만 고정하고 화면에 출처 표기",
        "배치 간격은 '약 5피트'로만 말할 것 (medium)",
        "1단계는 하천수를 순환시키는 공랭수, 그것만으로 부족해 2단계 냉동 플랜트의 냉수를 같은 관에 순환",
        "냉각탑은 1933년 8월, 냉동 플랜트는 1933년 10월 가동",
        "냉동 플랜트는 24시간에 얼음 1,000톤을 만들 수 있었다"
      ],
      "grounded_in": [
        "f10",
        "f11",
        "f08",
        "f09",
        "f14"
      ]
    },
    {
      "act": 6,
      "name": "벌어진 틈을 나중에 붙였다",
      "char_budget": 60,
      "must_convey": [
        "블록끼리는 키웨이(홈)로 서로 맞물리게 시공됐다",
        "높이 50피트 구간이 목표 온도까지 식을 때마다 수축 조인트를 그라우팅했다",
        "냉각 수축으로 벌어진 틈에 그라우트 422,000입방피트를 압력 주입했다",
        "즉 일체 구조는 처음부터가 아니라 사후에 만들어졌다"
      ],
      "grounded_in": [
        "f03",
        "f23",
        "f22",
        "f01"
      ]
    },
    {
      "act": 7,
      "name": "그 관은 아직 안에 있다",
      "char_budget": 55,
      "must_convey": [
        "냉각을 마친 강관은 철거되지 않고 잘라낸 뒤 그라우트로 채워져 지금도 댐 콘크리트 안에 남아 있다",
        "식는 일은 1935년에 끝났다 — '아직도 굳는 중'을 거짓이라 단정하지 말고 냉각 완료로만 한정",
        "훅으로 회귀: 우리가 보는 그 벽은 한 덩어리가 아니라 따로 식힌 기둥들을 붙여 세운 것"
      ],
      "grounded_in": [
        "f24",
        "f07",
        "f01",
        "f02"
      ]
    }
  ]
}
