{
  "topic": "보베 대성당 붕괴",
  "hook_candidates": [
    {
      "claim": "지구상에서 가장 높던 보베의 탑을 무너뜨린 직접 원인은 '너무 높이 지어서'가 아니라, 탑을 먼저 짓고 그것을 받쳐 줄 신랑을 나중으로 미룬 시공 순서였다",
      "why_surprising": "고딕 최고 높이 경쟁의 결말은 '오만이 부른 추락'으로 굳어 있다. 그런데 1550년 참사회가 신랑과 랜턴탑 중 탑을 먼저 짓기로 한 선택이 없었다면 같은 높이라도 서쪽에서 버텨 줄 구조가 있었다 — 실패한 것은 높이가 아니라 순서다",
      "grounded_in": [
        "f14",
        "f15",
        "f16",
        "f17",
        "f22"
      ]
    },
    {
      "claim": "1284년 붕괴 뒤 보베가 택한 재건은 원래 모습을 되살리는 복원이 아니라, 기둥을 두 배로 늘려 '빛과 개방감'이라는 원설계 의도를 스스로 폐기하는 일이었다",
      "why_surprising": "무너진 대성당은 '더 튼튼하게 다시 세웠다'로 끝나리라 여겨진다. 실제로는 넓은 베이 3개를 좁은 베이 6개로 쪼개고 볼트 형식까지 바꿔, 애초에 이 성당을 지은 이유를 건축가들이 손수 지웠다",
      "grounded_in": [
        "f10",
        "f11",
        "f12"
      ]
    },
    {
      "claim": "보베 대성당은 1993년에 세운 임시 버팀에 아직 기대어 서 있고, 그 거대한 목재 보를 걷어내는 작업이 2025년에야 시작됐다",
      "why_surprising": "중세 붕괴 이야기는 과거형으로 끝난다고 여겨지지만, 이 성당의 응급 처치는 30년 넘게 실내 40m 높이에 걸린 채 관람객 머리 위에 남아 있었다",
      "grounded_in": [
        "f28",
        "f29",
        "f32",
        "f33"
      ]
    }
  ],
  "chosen_hook": 0,
  "why_chosen": "기존 영상·문서가 '높이에 대한 오만 → 추락'으로 굳어 있어, 원인을 높이에서 시공 순서로 옮기는 순간 통념 뒤집기와 팩트시트의 twist가 동시에 성립한다. 축을 1573년 사건 하나로 확정할 수 있어 1284년과 1573년이 뒤섞이는 서사 분열을 피하고, 논쟁 중인 볼트 높이 수치에 훅을 걸지 않아도 된다. 무엇보다 '먼저 짓지 않은 신랑'이라는 훅의 핵심 명사가 마지막 단(끝내 지어지지 않은 신랑 자리)에서 그대로 되돌아와 수미상관이 자연스럽게 닫힌다.",
  "acts": [
    {
      "act": 1,
      "name": "무너뜨린 것은 높이가 아니라 순서였다",
      "char_budget": 80,
      "must_convey": [
        "1569년부터 1573년까지 4년 남짓, 지구상에서 가장 높은 인공 구조물은 보베 대성당의 탑이었다",
        "그 탑은 1573년에 무너졌다",
        "통념은 '너무 높이 지어서'지만, 직접 원인은 1550년 참사회가 신랑을 제쳐두고 탑부터 짓기로 한 순서였다"
      ],
      "grounded_in": [
        "f17",
        "f22",
        "f14"
      ]
    },
    {
      "act": 2,
      "name": "아미앵을 넘으려고 더 높이, 더 가볍게",
      "char_budget": 72,
      "must_convey": [
        "1225년 주교 Milon de Nanteuil과 참사회의 결정으로 착공",
        "볼트 높이는 동시대 아미앵 신랑 42.3m를 크게 웃도는 세계 최고의 교회 볼트(수치는 자료마다 갈리므로 '약 47m' 또는 정성 표현으로만)",
        "아미앵을 능가하려 후진과 트랜셉트 사이를 4베이가 아닌 3베이로 줄이고, 중앙부에 더 큰 높이와 더 큰 경량성을 주었다"
      ],
      "grounded_in": [
        "f02",
        "f04",
        "f05",
        "f10"
      ]
    },
    {
      "act": 3,
      "name": "완공 12년 만에, 그러나 전체가 아니라 일부",
      "char_budget": 68,
      "must_convey": [
        "새 고딕 성가대석은 1272년 완공되어 첫 미사를 올렸다",
        "1284년 11월 말, 완공 12년 뒤 볼트가 무너졌다",
        "전체 붕괴가 아니라 직선부 베이 볼트의 부분 붕괴였고 후진은 온전히 남았다",
        "원인은 오늘날까지 확정되지 않았다 — 강풍 공진설이 가장 널리 인용되지만 유력설일 뿐 정설이 아니라는 점을 드러낼 것"
      ],
      "grounded_in": [
        "f02",
        "f01",
        "f03",
        "f06",
        "f07"
      ]
    },
    {
      "act": 4,
      "name": "다시 세우며 원설계를 스스로 지웠다",
      "char_budget": 70,
      "must_convey": [
        "재건에서 직선부를 받치는 내부 기둥 수를 두 배로 늘려, 넓은 베이 3개를 좁은 베이 6개로 쪼갰다",
        "성가대석 앞쪽 세 볼트는 도리아치를 더해 사분 볼트에서 육분 볼트로 바뀌었고 지금도 눈으로 확인된다",
        "무너지지 않는 성당을 얻는 대가로 '빛과 개방감'이라는 원설계 의도를 포기했다",
        "구조 복구는 1338~1342년에 집중된 것으로 연구는 본다(연대는 확정이 아닌 연구 성과로 제시)"
      ],
      "grounded_in": [
        "f11",
        "f12",
        "f13"
      ]
    },
    {
      "act": 5,
      "name": "1550년, 신랑 대신 탑을 골랐다",
      "char_budget": 74,
      "must_convey": [
        "1550년 참사회는 신랑이 아니라 랜턴탑을 먼저 짓기로 결정했다",
        "Jean Vast의 설계가 1561년 채택되고 1563년 4월 공사가 시작됐다",
        "완성된 탑은 첨탑과 꼭대기 철 십자가까지 지상 153m (완공 연도는 자료가 갈리므로 '1560년대 말'로)",
        "서쪽에 신랑이 없어 버팀이 없는 채, 거대한 빈 공간 위 교차부의 유난히 가벼운 기둥 4개만이 탑을 떠받쳤다"
      ],
      "grounded_in": [
        "f14",
        "f16",
        "f15"
      ]
    },
    {
      "act": 6,
      "name": "경고는 6년 내내 있었다",
      "char_budget": 80,
      "must_convey": [
        "1567년부터 흔들림이 관측되고 1568년 7월 18일 첨탑 상부가 파손됐으며 네 기둥에서 침하와 휨이 확인됐는데도 공사는 계속됐다(성당 측 기록에 따른 서술임이 드러나게)",
        "지붕틀을 휘게 한다는 이유로 꼭대기 철 십자가를 떼어냈으나 소용없었다(제거 연도는 자료가 엇갈리므로 못 박지 말 것)",
        "붕괴 13일 전인 1573년 4월 17일에야 버팀 작업 인부를 고용했으나 이미 늦었다",
        "1573년 4월 30일 승천 대축일, 미사 행렬이 막 성당 밖으로 나간 직후 첨탑과 종탑 3개 층이 무너졌고 트랜셉트 볼트 일부도 함께 무너졌다",
        "사망자 기록은 남아 있지 않다(피해 수치는 쓰지 말 것)"
      ],
      "grounded_in": [
        "f19",
        "f20",
        "f21",
        "f22",
        "f23"
      ]
    },
    {
      "act": 7,
      "name": "신랑은 끝내 지어지지 않았다",
      "char_budget": 62,
      "must_convey": [
        "트랜셉트 볼트 재건 비용이 신랑 건설 자금을 영구히 삼킨 것으로 전해지며, 랜턴탑은 재건되지 않고 단순한 소종탑으로 대체됐다",
        "1600년 신랑 공사가 재개돼 1604년 첫 베이 하나에 볼트를 올렸으나 그 해 완전히 중단됐다",
        "지어지지 못한 신랑 자리에는 949~998년 사이의 카롤링거기 성당 Basse-Œuvre가 9베이 중 3.5베이만 남은 채 그대로 붙어 있다",
        "이 이야기에는 해법 구간이 없다 — 매번의 대응이 포기였다는 점"
      ],
      "grounded_in": [
        "f24",
        "f25",
        "f36"
      ]
    },
    {
      "act": 8,
      "name": "탑도 신랑도 없이, 그 기둥들은 아직 서 있다",
      "char_budget": 54,
      "must_convey": [
        "지금 보베에는 탑도 신랑도 없이 성가대석과 트랜셉트, 신랑 한 베이만 선 채로 여전히 미사가 열린다",
        "교차부 기둥들은 1993년 성당을 가로질러 설치한 관통 버팀에 붙들려 왔고, 40m 높이의 거대 목재 보는 2025년 3월부터 2028년까지 단계적으로 걷어내는 중이다(현재 잔존 상태는 진행형으로만)",
        "1차 해체 뒤 수석건축가는 성당이 1mm도 움직이지 않았다고 밝혔다",
        "미완성은 패배가 아니라 한계를 알아낸 기록이라는 최근의 재해석(훈화조 금지, 한 줄로만)"
      ],
      "grounded_in": [
        "f35",
        "f28",
        "f29",
        "f32",
        "f33",
        "f42"
      ]
    }
  ]
}
