{
  "topic": "다다미 치수 지역차 (京間·江戸間)",
  "hook_candidates": [
    {
      "claim": "일본에서 같은 '6조 방'이라도 교토식이면 약 11㎡, 도쿄식이면 약 9.3㎡ — 약 1.7㎡, 방 하나 값의 넓이가 통째로 달라진다",
      "why_surprising": "'6조'는 다다미 장수로 넓이를 세는 단위이므로 어디서나 같은 넓이를 가리킨다고 전제하게 된다. 단위처럼 쓰이는 말이 지역에 따라 실넓이가 달라진다는 것은 그 전제와 정면으로 어긋난다",
      "grounded_in": [
        "f10",
        "f11"
      ]
    },
    {
      "claim": "다다미 크기가 지역마다 다른 진짜 이유는 다다미 짜는 법이 아니라 길이 단위 '1間' 자체가 교토 6尺5寸, 에도 6尺으로 서로 달랐기 때문이다",
      "why_surprising": "물건(다다미)의 지역차는 상상해도 자(단위)의 지역차는 상상하지 못한다. '京間'이라는 이름부터가 에도의 6尺짜리 1間과 구별하기 위해 붙은 대비 호칭이다",
      "grounded_in": [
        "f05",
        "f06",
        "f07"
      ]
    },
    {
      "claim": "1891년 법률이 1間=6尺으로 단위를 못 박았는데도 다다미는 따라가지 않았고, 지금도 국가규격이 표준치수를 하나가 아니라 4구분으로 나란히 병기한다",
      "why_surprising": "국가가 법으로 단위를 통일하면 파생 규격도 당연히 따라간다는 상식과 어긋난다. 표준을 정하는 문서가 표준을 하나로 정하기를 포기한 형태다",
      "grounded_in": [
        "f14",
        "f15",
        "f01"
      ]
    }
  ],
  "chosen_hook": 0,
  "why_chosen": "twist 지표가 false라 '통념 뒤집기'가 아니라 '몰랐던 사실'로 세워야 하는 소재인데, 후보 1·2는 시청자에게 해당 통념이 실재해야 힘이 생긴다. 후보 0은 통념 없이도 숫자만으로 손해·이득의 감각을 즉시 만들고(같은 계약, 약 1.7㎡ 차이), 팩트시트가 인정한 두 놀라움 숫자(f10·f11, f12)를 훅과 엔딩에 하나씩 배치해 부동산 광고의 '6조'로 수미상관을 닫을 수 있다. 후보 1의 각도는 버리지 않고 해법 구간(3단)의 축으로 쓴다",
  "acts": [
    {
      "act": 1,
      "name": "같은 6조인데 넓이가 다르다",
      "char_budget": 70,
      "must_convey": [
        "같은 '6조' 방이 京間 기준 약 11㎡, 江戸間 기준 약 9.3㎡로 계산된다 (업계 해설의 계산치임이 드러나는 표현으로)",
        "차이는 약 1.7㎡, 방의 세로로 30cm·가로로 22.5cm",
        "새 수치를 계산해 만들지 않는다 — 약 1.7㎡, 30cm, 22.5cm 등 팩트시트에 있는 숫자만 쓴다"
      ],
      "grounded_in": [
        "f10",
        "f11"
      ]
    },
    {
      "act": 2,
      "name": "다다미 한 장부터 크기가 다르다",
      "char_budget": 75,
      "must_convey": [
        "京間 다다미 한 장은 1,910mm×955mm",
        "江戸間 다다미 한 장은 1,760mm×880mm",
        "京間은 관서, 江戸間은 관동에서 쓰이는 규격의 이름이다"
      ],
      "grounded_in": [
        "f02",
        "f03",
        "f28"
      ]
    },
    {
      "act": 3,
      "name": "다다미가 아니라 자가 달랐다",
      "char_budget": 95,
      "must_convey": [
        "차이의 뿌리는 다다미 제작이 아니라 기준 단위 1間의 길이",
        "교토는 1間을 6尺5寸(약 197cm)으로, 에도는 6尺(약 182cm)으로 잡았고 이것은 기둥 간격의 기준치수다",
        "'京間'이라는 이름 자체가 에도의 6尺 1間과 구별하려고 교토의 6尺5寸 1間에 붙은 대비 호칭이다"
      ],
      "grounded_in": [
        "f05",
        "f06",
        "f07"
      ]
    },
    {
      "act": 4,
      "name": "에도가 다다미 먼저 깔기를 버렸다",
      "char_budget": 95,
      "must_convey": [
        "다다미를 먼저 배치하고 기둥을 맞추는 畳割 방식이 있었다",
        "에도 목수가 이를 버린 이유를 국회도서관 레퍼런스 회답은 '방 넓이마다 기둥 간격이 달라지고 숫자가 어중간해져 계산과 목재 절단에 품이 든다'고 기록한다 (회답 귀속 표현으로, 단정하지 않는다)",
        "기둥 간격을 딱 떨어지는 6尺으로 고정한 결과 다다미가 5尺8寸으로 작아졌다는 설명 (같은 회답 귀속)",
        "'서일본=畳割, 동일본=柱割' 같은 동서 지역 이분법으로 일반화하지 않는다 — 관동·도호쿠에도 畳割 민가가 널리 있었다는 기술이 있다"
      ],
      "grounded_in": [
        "f13",
        "f23"
      ]
    },
    {
      "act": 5,
      "name": "법이 자를 통일해도 다다미는 남았다",
      "char_budget": 90,
      "must_convey": [
        "1891년 度量衡法(법률 제3호)이 1間=6尺으로 법정화했다",
        "그런데도 다다미 치수의 지역차는 사라지지 않았다",
        "지금도 일본 국가규격 JIS의 다다미 표준표는 치수를 하나로 정하지 않고 4구분을 나란히 병기한다 — 1,910×955, 1,820×910, 1,760×880 계열",
        "규격의 번호·제정 연도 등 팩트시트 numbers에 없는 숫자는 대사·자막에 쓰지 않는다 (JIS라는 명칭까지만)"
      ],
      "grounded_in": [
        "f14",
        "f15",
        "f01"
      ]
    },
    {
      "act": 6,
      "name": "도쿄의 다실은 지금도 교토 치수",
      "char_budget": 55,
      "must_convey": [
        "다도에서는 지역과 무관하게 京間 다다미가 기준이다",
        "관동에 있는 다실도 다다미만은 京間을 쓴다"
      ],
      "grounded_in": [
        "f19"
      ]
    },
    {
      "act": 7,
      "name": "부동산 광고의 6조로 돌아오면",
      "char_budget": 80,
      "must_convey": [
        "일본 부동산 광고 규약은 다다미 크기를 하나로 통일하는 대신 하한선만 긋는다 — 1畳을 1.62㎡ 이상의 의미로 쓰도록 규정 (규약 시행규칙 귀속 표현으로)",
        "그래서 광고 속 '6조'는 지금도 어느 다다미의 6조냐에 따라 실제 넓이가 달라진다 — 훅의 약 11㎡와 약 9.3㎡로 되돌아온다",
        "엔딩 문장에 훅의 핵심 명사 '6조'·'다다미'·'넓이'를 반드시 다시 쓴다 (수미상관)"
      ],
      "grounded_in": [
        "f12",
        "f10",
        "f11"
      ]
    }
  ]
}
